{"case_id":"2c1f188c-eef1-46d8-9be5-95f1c1c64218","indicator_set_id":"4c8c5935-026b-4e1a-9bae-951ee06a0a2b","indicators":[{"indicator_id":"662cdfa2-26e8-5cf4-a3e3-2583bac5e172","kind":"sha256","value":"00000000000000000000000000000000000000000000000000000000000f4240"},{"indicator_id":"ff28d924-d13f-5d3e-8e0c-9a6ccf997e9a","kind":"sha256","value":"00000000000000000000000000000000000000000000000000000000000f4241"},{"indicator_id":"59589825-0a4f-5e03-bd99-1fff4577ac53","kind":"sha256","value":"00000000000000000000000000000000000000000000000000000000000f4242"},{"indicator_id":"3d390bf9-25f3-5033-aeb4-7fa55162a2e6","kind":"sha256","value":"00000000000000000000000000000000000000000000000000000000000f4243"},{"indicator_id":"de2b7aa1-6f51-5e51-9511-8801d6882e3c","kind":"sha256","value":"00000000000000000000000000000000000000000000000000000000000f4244"},{"indicator_id":"f6a0b3e0-2ee6-5c70-81fb-a2d008830a34","kind":"sha256","value":"00000000000000000000000000000000000000000000000000000000000f4245"},{"indicator_id":"4e87bc01-8b22-50df-9eaf-12ab4d9de9ec","kind":"sha256","value":"00000000000000000000000000000000000000000000000000000000000f4246"},{"indicator_id":"241f6fdd-4d01-599e-aaff-7dbdbe2666db","kind":"sha256","value":"00000000000000000000000000000000000000000000000000000000000f4247"},{"indicator_id":"0eb7d1c7-8142-5a35-9706-0a6d3ebbdd0c","kind":"sha256","value":"00000000000000000000000000000000000000000000000000000000000f4248"},{"indicator_id":"a0b1ca2e-b22c-582d-881c-5307ec96dad4","kind":"sha256","value":"00000000000000000000000000000000000000000000000000000000000f4249"},{"indicator_id":"69c704da-493a-54da-bcdf-390abe1f77b9","kind":"sha256","value":"00000000000000000000000000000000000000000000000000000000000f424a"},{"indicator_id":"2a353e95-5a05-5dbe-abb7-e16b1d610733","kind":"sha256","value":"00000000000000000000000000000000000000000000000000000000000f424b"},{"indicator_id":"c277480f-c70d-5663-b3d8-8e4c76879245","kind":"sha256","value":"00000000000000000000000000000000000000000000000000000000000f424c"},{"indicator_id":"c7a16ede-5b17-5a93-a098-209d74c6ac77","kind":"sha256","value":"00000000000000000000000000000000000000000000000000000000000f424d"},{"indicator_id":"55afe95f-d68d-5b23-939f-250f256e339d","kind":"sha256","value":"00000000000000000000000000000000000000000000000000000000000f424e"},{"indicator_id":"aa809a25-7cb0-5f25-83d7-e47fa1ab1028","kind":"sha256","value":"00000000000000000000000000000000000000000000000000000000000f424f"},{"indicator_id":"c1b92f1f-1a7c-559e-9370-1778d0d1f6e8","kind":"sha256","value":"00000000000000000000000000000000000000000000000000000000000f4250"},{"indicator_id":"c9d98463-f67c-51d6-9b7f-31b3f74fbf3d","kind":"sha256","value":"00000000000000000000000000000000000000000000000000000000000f4251"},{"indicator_id":"9397bd05-151d-5084-9601-caa916d5b26e","kind":"sha256","value":"00000000000000000000000000000000000000000000000000000000000f4252"},{"indicator_id":"1791d429-9dbf-50d9-a012-bdce0ccf37a8","kind":"sha256","value":"00000000000000000000000000000000000000000000000000000000000f4253"},{"indicator_id":"b76890d9-a72e-550f-8fc8-bbf49fd32846","kind":"sha256","value":"00000000000000000000000000000000000000000000000000000000000f4254"},{"indicator_id":"07159176-3086-5e3f-a3fd-cf2cd5475165","kind":"sha256","value":"00000000000000000000000000000000000000000000000000000000000f4255"},{"indicator_id":"96387c46-29af-58a7-9136-f3133f117cb0","kind":"sha256","value":"00000000000000000000000000000000000000000000000000000000000f4256"},{"indicator_id":"f19c5e98-c05f-5170-9183-5b08a7a108ec","kind":"sha256","value":"00000000000000000000000000000000000000000000000000000000000f4257"},{"indicator_id":"a19938d9-91a0-57c1-bf37-7f49e4498212","kind":"sha256","value":"00000000000000000000000000000000000000000000000000000000000f4258"},{"indicator_id":"b82885c2-cec4-5450-ae9d-283e099b24df","kind":"sha256","value":"00000000000000000000000000000000000000000000000000000000000f4259"},{"indicator_id":"e8e1d507-004e-5413-a672-805093285c49","kind":"sha256","value":"00000000000000000000000000000000000000000000000000000000000f425a"},{"indicator_id":"119fb6e1-3eb0-5930-a3c4-a5000a1e711e","kind":"sha256","value":"00000000000000000000000000000000000000000000000000000000000f425b"},{"indicator_id":"62eed365-2e46-5969-a0f4-f259ee813cd4","kind":"sha256","value":"00000000000000000000000000000000000000000000000000000000000f425c"},{"indicator_id":"ca5adf33-c424-59c6-8407-5e67f4fa12d0","kind":"sha256","value":"00000000000000000000000000000000000000000000000000000000000f425d"},{"indicator_id":"e78c4aea-6926-5696-a45d-d9328f150bf2","kind":"sha256","value":"00000000000000000000000000000000000000000000000000000000000f425e"},{"indicator_id":"54c8c627-a533-5041-a38e-a70a2f69abdf","kind":"sha256","value":"00000000000000000000000000000000000000000000000000000000000f425f"},{"indicator_id":"3f57fb78-db96-502e-9f83-f2ee9008d06c","kind":"sha256","value":"00000000000000000000000000000000000000000000000000000000000f4260"},{"indicator_id":"e40b5f16-f1a1-5309-939f-1e42d5f5d4d8","kind":"sha256","value":"00000000000000000000000000000000000000000000000000000000000f4261"},{"indicator_id":"5c0ce3eb-ca4e-5e44-8fa1-b0699dfddf11","kind":"sha256","value":"00000000000000000000000000000000000000000000000000000000000f4262"},{"indicator_id":"cdce5010-0206-591a-87eb-a611a5d78908","kind":"sha256","value":"00000000000000000000000000000000000000000000000000000000000f4263"},{"indicator_id":"aceef501-86b4-5d80-8a65-ad1d98ee3d3a","kind":"sha256","value":"00000000000000000000000000000000000000000000000000000000000f4264"},{"indicator_id":"4fe4057c-e1b1-5f70-bdd5-ef7aa4d9f03d","kind":"sha256","value":"00000000000000000000000000000000000000000000000000000000000f4265"},{"indicator_id":"ddcf183e-51b3-5856-8c36-7bef865dadc2","kind":"sha256","value":"00000000000000000000000000000000000000000000000000000000000f4266"},{"indicator_id":"0e2949a9-0e30-5dc9-a439-e924e1889a7b","kind":"sha256","value":"00000000000000000000000000000000000000000000000000000000000f4267"},{"indicator_id":"ed8a2708-3d53-5d2d-96cc-0021dc78ab18","kind":"sha256","value":"00000000000000000000000000000000000000000000000000000000000f4268"},{"indicator_id":"6225d430-f7e2-534f-ab15-644effa497ee","kind":"sha256","value":"00000000000000000000000000000000000000000000000000000000000f4269"},{"indicator_id":"4e0b5b9a-8ac7-595f-a061-b641e3db4b52","kind":"sha256","value":"00000000000000000000000000000000000000000000000000000000000f426a"},{"indicator_id":"db8ef776-37dd-56c2-a881-f5cdcc4c8226","kind":"sha256","value":"00000000000000000000000000000000000000000000000000000000000f426b"},{"indicator_id":"47756362-32b5-5cca-853c-7abf6f615acd","kind":"sha256","value":"00000000000000000000000000000000000000000000000000000000000f426c"},{"indicator_id":"5df9429c-fa61-5d20-b0e8-201d9cffb945","kind":"sha256","value":"00000000000000000000000000000000000000000000000000000000000f426d"},{"indicator_id":"39eaa477-ef53-5c99-80b5-0b5e0b651219","kind":"sha256","value":"00000000000000000000000000000000000000000000000000000000000f426e"},{"indicator_id":"a35adc37-79bb-5187-beb4-1bf2e71ea441","kind":"sha256","value":"00000000000000000000000000000000000000000000000000000000000f426f"},{"indicator_id":"1b38d7eb-5fe2-519f-9e2a-650bfeb04f74","kind":"sha256","value":"00000000000000000000000000000000000000000000000000000000000f4270"},{"indicator_id":"edeb97f3-5471-5e97-a800-e17c03afba99","kind":"sha256","value":"00000000000000000000000000000000000000000000000000000000000f4271"},{"indicator_id":"159e7471-c9e4-5531-8cf1-506304df89da","kind":"sha256","value":"00000000000000000000000000000000000000000000000000000000000f4272"},{"indicator_id":"d2747195-e7d9-596d-be0c-09d5f67c222d","kind":"sha256","value":"00000000000000000000000000000000000000000000000000000000000f4273"},{"indicator_id":"6734541b-6eb0-5238-b9ed-db7b345df7ea","kind":"sha256","value":"00000000000000000000000000000000000000000000000000000000000f4274"},{"indicator_id":"0680e959-8d57-50e9-818e-ef6ba148f841","kind":"sha256","value":"00000000000000000000000000000000000000000000000000000000000f4275"},{"indicator_id":"5edcd9b1-c99d-5786-bd80-cf95a02b5e58","kind":"sha256","value":"00000000000000000000000000000000000000000000000000000000000f4276"},{"indicator_id":"d91ad244-f1fc-5274-bf9b-43ae55dffd7e","kind":"sha256","value":"00000000000000000000000000000000000000000000000000000000000f4277"},{"indicator_id":"6b5b0a57-8834-54fe-9b93-c826446501a8","kind":"sha256","value":"00000000000000000000000000000000000000000000000000000000000f4278"},{"indicator_id":"8e6efc6c-c480-524d-a0fc-9e594133974a","kind":"sha256","value":"00000000000000000000000000000000000000000000000000000000000f4279"},{"indicator_id":"7cec9f2f-3cd8-525f-8152-7e2c3fe7b1fe","kind":"sha256","value":"00000000000000000000000000000000000000000000000000000000000f427a"},{"indicator_id":"646611d6-a371-5246-b9a5-664b8634f5c1","kind":"sha256","value":"00000000000000000000000000000000000000000000000000000000000f427b"},{"indicator_id":"92a2d102-dc1d-5ab4-bb1c-d7edce589401","kind":"sha256","value":"00000000000000000000000000000000000000000000000000000000000f427c"},{"indicator_id":"0b4c991e-8630-55d8-a001-9421900ab252","kind":"sha256","value":"00000000000000000000000000000000000000000000000000000000000f427d"},{"indicator_id":"7d3588f3-2e50-55f6-93ba-ca1039edcf26","kind":"sha256","value":"00000000000000000000000000000000000000000000000000000000000f427e"},{"indicator_id":"4b62b9f9-fd48-55ad-bba4-85ed0f556ba1","kind":"sha256","value":"00000000000000000000000000000000000000000000000000000000000f427f"},{"indicator_id":"c690ba5a-6301-55f9-9ef4-26c0ef04cf02","kind":"sha256","value":"00000000000000000000000000000000000000000000000000000000000f4280"},{"indicator_id":"b7bf5e93-6dcb-57a0-a311-c151237c3515","kind":"sha256","value":"00000000000000000000000000000000000000000000000000000000000f4281"},{"indicator_id":"1f319e74-53ba-5676-be0c-cd9f79f5ff70","kind":"sha256","value":"00000000000000000000000000000000000000000000000000000000000f4282"},{"indicator_id":"b2247e27-023